{"$schema":"https://json-schema.org/draft/2020-12/schema","$id":"https://salus.example/schemas/uc3/event.schema.json","type":"object","additionalProperties":false,"required":["event_id","event_type","event_time","ingest_time","source_entity","target_entity","message_id","attributes","payload_hash","observable"],"properties":{"event_id":{"type":"string","pattern":"^UC3-EV-[0-9]{6}$"},"event_type":{"type":"string"},"event_time":{"type":"number","minimum":0},"ingest_time":{"type":"number","minimum":0},"source_entity":{"type":"string","pattern":"^UC3-"},"target_entity":{"type":"string","pattern":"^UC3-"},"message_id":{"type":["string","null"]},"attributes":{"type":"object"},"payload_hash":{"type":"string","pattern":"^[a-f0-9]{64}$"},"observable":{"type":"boolean"}}}
